{
  "brief_id": "type-tips",
  "topic": "타이포그래피 입문",
  "audience": "초보 디자이너",
  "goal": "핵심 팁 저장 유도",
  "language": "ko",
  "slide_count": 2,
  "canvas": {
    "width": 1080,
    "height": 1350
  },
  "safe_area": {
    "horizontal": 72,
    "vertical": 72
  },
  "references": [],
  "brand": {
    "required_elements": [],
    "constraints": []
  },
  "mode": "plan_only",
  "assumptions": [
    "사용자 레퍼런스가 없어 크림색 배경과 검정 타이포 방향을 임시 제안한다."
  ]
}
